title,url,time_added,tags,status,content
"Digital Asset Management, Open Source, Media Asset Management, Software, Sy",http://www.razuna.org/,1501494425,dam,unread,
"Augmenting Human Intellect: A Conceptual Framework - 1962 (AUGMENT,3906,) -",https://www.dougengelbart.org/pubs/augment-3906.html,1509256882,archivi,unread,
https://www.francopaniniragazzi.it/,https://www.francopaniniragazzi.it/,1522996686,,unread,
"Statistics in Plain English, Fourth Edition : Timothy C. Urdan - Book2look",https://www.book2look.com/,1672217314,,unread,
Augmented Reality | Interactive Print | Layar,https://www.layar.com/,1506346149,tour,unread,
Neuschwanstein Castle - Wikipedia,https://en.wikipedia.org/wiki/Neuschwanstein_Castle,1704524245,,unread,
How to Draw Trees Quickly and Easily,http://www.how-to-draw-and-paint.com/how-to-draw-trees.html,1589788673,,unread,
"Bleeding Green Nation, a Philadelphia Eagles community",https://www.bleedinggreennation.com/,1606925368,,unread,
The Mahler Symphonies: A synoptic survey by Tony Duggan,http://www.musicweb-international.com/Mahler/index.html,1531142839,,unread,
Password Safe,https://pwsafe.org/,1557760447,,unread,
