title,url,time_added,tags,status,content
Ten Lessons I Wish I Had Been Taught,https://www.ams.org/notices/199701/comm-rota.pdf,1719492645,,unread,
Veronica Guerin - Wikipedia,https://en.wikipedia.org/wiki/Veronica_Guerin,1693581374,,unread,
Xaaraan - Il blog di Antonella Beccaria | Non credo nelle otto del mattino.,http://antonella.beccaria.org/,1603000777,,unread,
"Create Face Online, Create Your Portrait Caricature Online",http://www.pimptheface.com/create/,1450302747,,unread,
Chinese Painting | Essay | The Metropolitan Museum of Art | Heilbrunn Timel,https://www.metmuseum.org/toah/hd/chin/hd_chin.htm,1599214630,disegno,unread,
Perfect Full Page Background Image | CSS-Tricks,https://css-tricks.com/perfect-full-page-background-image/,1453398284,corsi|css,unread,
"Lyle and Erik Menendez - Wikipedia, the free encyclopedia",https://en.wikipedia.org/wiki/Lyle_and_Erik_Menendez,1465508929,,unread,
New Horizons: Beyond Pluto,http://pluto.jhuapl.edu/,1648212688,,unread,
"Pro Football Stats, History, Scores, Standings, Playoffs, Schedule & Record",https://www.pro-football-reference.com/,1666973201,,unread,
La morte è meglio di tutto questo,http://documentazione.altervista.org/meierchold.htm,1554873186,,unread,
